,Title,Rating,Designation,Pros,Cons,Date,Position,sentiment,all_features
442,No long term strategy,1,"Former Employee, more than 5 years","Well positioned portfolio, Compensation is good.","Leadership does not follow company's values, lack of synergy among different business units.",2019," Senior Director in Troy, MI",0,"No long term strategy Well positioned portfolio, Compensation is good. Leadership does not follow company's values, lack of synergy among different business units."
443,Super company,4,Current Employee,Good to learn this place,HR not like HR nod good,2019,  ,1,Super company Good to learn this place HR not like HR nod good
444,Braga Technical Center,4,"Current Employee, more than 1 year",- Young Team; - Very nice atmosphere; - New Open-space office;,"- Focus on results, not people; - Technical Center is still starting; - Not so much travel as they promise",2019, Anonymous Employee in Braga,1,"Braga Technical Center - Young Team; - Very nice atmosphere; - New Open-space office; - Focus on results, not people; - Technical Center is still starting; - Not so much travel as they promise"
445,Not at all comfortable place to work,1,"Current Employee, less than 1 year",Nothing much. Retirement benefits are good.,"I was interviewed for one role and was given totally different role when I joined. Lot of work pressure. Management not sensible. Poor work culture . Expected to work on weekends, infact 24x7. They intentionally keep 1 hr meetings at 6pm. I was assigned bugs on Day2. My worst job experience so far in life.no good Chairs. No work life balance. I have to survive until I find a good job",2019," Anonymous Employee in Troy, MI",0,"Not at all comfortable place to work Nothing much. Retirement benefits are good. I was interviewed for one role and was given totally different role when I joined. Lot of work pressure. Management not sensible. Poor work culture . Expected to work on weekends, infact 24x7. They intentionally keep 1 hr meetings at 6pm. I was assigned bugs on Day2. My worst job experience so far in life.no good Chairs. No work life balance. I have to survive until I find a good job"
446,AptivMobility,5,"Current Employee, more than 1 year","Great colleagues, great work space environment. Awesome industry.",Progression is non existent unless you're friends with the management.,2019," Vehicle Operator in Las Vegas, NV",1,"AptivMobility Great colleagues, great work space environment. Awesome industry. Progression is non existent unless you're friends with the management."
447,Design engineer,4,"Current Employee, more than 3 years",good working environment and no full night shifts,no flexible shift and alternate Saturday working,2019, Design Engineer in Chennai,1,Design engineer good working environment and no full night shifts no flexible shift and alternate Saturday working
449,Polyvalent at Aptiv,1,"Current Employee, more than 1 year","Salary always on time,health care,paid transport to work.","Very frequent work at saturdays and working over time (although paid over time) Very stressful,unhealthy relationships between employees Broken and half decent machines,tools and equipment Bad work environment (super high temperatures with bad air flow) Employees with the same amount of hours at the same positions,even started working for the company the same day, getting different salaries (didnt make any penalties yet their salaries being poorly calculated, a.k.a. robbed,if you prefere) Super high unrealistic expectations from employees,that are working on broken/malfunctioning machines and tools Family and long time relationships dictating who gets promoted and who doesn't",2019, Polyvalent Operator in Novi Sad,0,"Polyvalent at Aptiv Salary always on time,health care,paid transport to work. Very frequent work at saturdays and working over time (although paid over time) Very stressful,unhealthy relationships between employees Broken and half decent machines,tools and equipment Bad work environment (super high temperatures with bad air flow) Employees with the same amount of hours at the same positions,even started working for the company the same day, getting different salaries (didnt make any penalties yet their salaries being poorly calculated, a.k.a. robbed,if you prefere) Super high unrealistic expectations from employees,that are working on broken/malfunctioning machines and tools Family and long time relationships dictating who gets promoted and who doesn't"
450,I have loved working here so far. The people genuinely care about each other and their users!,5,Current Employee,"Great team, management listens to employees and works to address any concerns, good atmosphere even after acquisition. The employees genuinely care about making a safe and reliable product.",Still maturing as an organization,2019," Senior Software Engineer in Boston, MA",1,"I have loved working here so far. The people genuinely care about each other and their users! Great team, management listens to employees and works to address any concerns, good atmosphere even after acquisition. The employees genuinely care about making a safe and reliable product. Still maturing as an organization"
451,Excellent learning Opportunity,4,"Current Employee, more than 1 year",excellent team to work with upcoming technologies,facilities provided are not that much good,2019, Software Engineer in Bangalore,1,Excellent learning Opportunity excellent team to work with upcoming technologies facilities provided are not that much good
452,Software Engineer,1,"Current Employee, more than 1 year",Not a single thing to look forward to.,worst culture ever one can imagine,2019, Anonymous Employee ,0,Software Engineer Not a single thing to look forward to. worst culture ever one can imagine
453,In state of flux,1,"Former Employee, more than 8 years",Cater to milenials. Try to add youth to an aging workforce.,Aptiv is tryy to figure out what they are. Constant change and no security. Moving jobs offshore whenever possible.,2019," Financial Analyst in Troy, MI",0,In state of flux Cater to milenials. Try to add youth to an aging workforce. Aptiv is tryy to figure out what they are. Constant change and no security. Moving jobs offshore whenever possible.
454,Great Company to work with,5,"Former Employee, more than 1 year","Good environment, good benefits, I would recommend it.",During the time I worked there I saw no Cons,2019, Sales Engineer in Ciudad de Mexico,1,"Great Company to work with Good environment, good benefits, I would recommend it. During the time I worked there I saw no Cons"
455,Sinking Ship. Run fast in the opposite direction,1,"Former Employee, more than 1 year",None that are worth the headache.,No leadership. Terrible work environment. Executives lie through their teeth about the state of the company... which is not good.,2019," Senior in East Las Vegas, NV",0,Sinking Ship. Run fast in the opposite direction None that are worth the headache. No leadership. Terrible work environment. Executives lie through their teeth about the state of the company... which is not good.
457,VO,2,"Former Employee, more than 1 year",Awesome technology Good working environment Friendly colleague,"Bad management, lots of last minute plans, double management, managers are not on the ground and lack of knowledge. Bad communication between different teams, always make it mess. Zero career progression of current team, unless transfer to other teams and start as a fresh. Managers are actually do nothing but get more pay. Resources are limited for fresh to learn and get trained.",2019, Anonymous Employee ,0,"VO Awesome technology Good working environment Friendly colleague Bad management, lots of last minute plans, double management, managers are not on the ground and lack of knowledge. Bad communication between different teams, always make it mess. Zero career progression of current team, unless transfer to other teams and start as a fresh. Managers are actually do nothing but get more pay. Resources are limited for fresh to learn and get trained."
458,Toxic chaos.,2,"Former Employee, less than 1 year","Pay above market, reasonably good IT.","Too many international development groups, too much offshoring. Inefficient communications as a result of offshoring. Chaotic product development and late hours.",2019," Software Developer in Kokomo, IN",0,"Toxic chaos. Pay above market, reasonably good IT. Too many international development groups, too much offshoring. Inefficient communications as a result of offshoring. Chaotic product development and late hours."
461,Good company,4,Current Employee,"Nice company, can learn many things",Nothing to say about cons,2019, Anonymous Employee ,1,"Good company Nice company, can learn many things Nothing to say about cons"
464,"if you are used to internal politics, do join, you will enjoy",1,"Current Employee, less than 1 year","office timing is good, transportation facility, food, training's","cannot work independently, lot of internal politics, everyone in organisation will try to pull you leg so that you don't grow",2019, Deputy Manager in Dhruhera,0,"if you are used to internal politics, do join, you will enjoy office timing is good, transportation facility, food, training's cannot work independently, lot of internal politics, everyone in organisation will try to pull you leg so that you don't grow"
466,Not so gud for growth,2,Former Employee,Good for fresher's to learn,"Politics , no growth .. not employee friendly,HR department is not gud",2019, Senior Electrical Engineer in Bangalore,0,"Not so gud for growth Good for fresher's to learn Politics , no growth .. not employee friendly,HR department is not gud"
467,Good place to work and challenge yourself.,4,"Current Employee, more than 3 years","High technology projects, good management and nice work environment.",It's difficult to grow inside the company,2019," Software Engineer in Quer茅taro, Quer茅taro, Quer茅taro",1,"Good place to work and challenge yourself. High technology projects, good management and nice work environment. It's difficult to grow inside the company"
472,Great Company,5,"Current Employee, less than 1 year",Working with absolutely brilliant people in a diverse environment is just great.,A bit of bureaucracy as in all large organizations.,2019, Onsite Support Engineer ,1,Great Company Working with absolutely brilliant people in a diverse environment is just great. A bit of bureaucracy as in all large organizations.
473,Worst working environment. Huge bureaucracy. Lost of upper management levels and departments that are useless.,1,"Former Employee, more than 1 year",Large company leader in the industry,Lots of mid to upper management levels that are only looking not to be fired. No contribution to the business and they lie to the executives about the financials. They make unattainable comments they role out every month and goals never get accomplished since the actual plans are not followed. Work ethics at some director levels are extremely questionable,2019, Director of Operations in Ciudad de Mexico,0,Worst working environment. Huge bureaucracy. Lost of upper management levels and departments that are useless. Large company leader in the industry Lots of mid to upper management levels that are only looking not to be fired. No contribution to the business and they lie to the executives about the financials. They make unattainable comments they role out every month and goals never get accomplished since the actual plans are not followed. Work ethics at some director levels are extremely questionable
474,Good company,5,"Current Employee, more than 3 years",Flexible Work Hours and holiday schedule. Knowledgeable staff,Cant think of any Cons,2019, Validation Engineer ,1,Good company Flexible Work Hours and holiday schedule. Knowledgeable staff Cant think of any Cons
475,2 years at aptiv,4,"Current Employee, more than 1 year",Good company for your carrier growth.,medical is expensive compare to other company.,2019, Project Manager ,1,2 years at aptiv Good company for your carrier growth. medical is expensive compare to other company.
476,Excellent place to learn and grow,4,"Current Employee, less than 1 year",Good Management Supportive peers Great work life balance,Salary structure is not uniform,2019, Systems Engineer in Krak贸w,1,Excellent place to learn and grow Good Management Supportive peers Great work life balance Salary structure is not uniform
477,Project Engineer,4,Current Employee,Good Working Environment and humanly approach,"Nothing much, all is well and good",2019, Anonymous Employee ,1,"Project Engineer Good Working Environment and humanly approach Nothing much, all is well and good"
478,Sold out US workers and lied to those in Ireland,1,Former Employee,They subsidies the lunch room.,Management lacks integrity. Executives are allowed to discriminate against employees and are backed bu HR in doing so. Career growth has been stopped so excellent employees are forced to leave. Management also sold out US workers with move of the HQ to Ireland. They could have made it work for everyone if they chose. People in Ireland also feel lied to. Just no integrity.,2019,  ,0,Sold out US workers and lied to those in Ireland They subsidies the lunch room. Management lacks integrity. Executives are allowed to discriminate against employees and are backed bu HR in doing so. Career growth has been stopped so excellent employees are forced to leave. Management also sold out US workers with move of the HQ to Ireland. They could have made it work for everyone if they chose. People in Ireland also feel lied to. Just no integrity.
480,Wonder Full Work Environment,4,"Former Employee, more than 3 years","Good Work, supportive Management, great Work-Life Balance",Growth Depends On the projects,2019, Anonymous Employee in Bangalore,1,"Wonder Full Work Environment Good Work, supportive Management, great Work-Life Balance Growth Depends On the projects"
481,Poland opinion,4,"Current Employee, more than 1 year",Nice and help-full people in team,Management do not see why people left this company,2018, Systems Test Engineer in Krak贸w,1,Poland opinion Nice and help-full people in team Management do not see why people left this company
484,Company with good opportunities in automotive sector.,5,Current Employee,Good place to start with.,No downsides as such.It also depends on the team one is working with.,2018, Anonymous Employee ,1,Company with good opportunities in automotive sector. Good place to start with. No downsides as such.It also depends on the team one is working with.
485,Work full of young professionals,5,Current Employee,"Many challenges, new projects, elastic work hours, well organised, amazing team integration",There are no cons for me at this moment,2018, Anonymous Employee ,1,"Work full of young professionals Many challenges, new projects, elastic work hours, well organised, amazing team integration There are no cons for me at this moment"
486,Very Nice company to work for! Happy tonwork here,4,"Current Employee, more than 3 years",Employee friendly Management is good Good benefits to employees Flexible working hours Nice learning No pressure,Not faced any till now,2018, Advanced Applications Engineer in Whitefield,1,Very Nice company to work for! Happy tonwork here Employee friendly Management is good Good benefits to employees Flexible working hours Nice learning No pressure Not faced any till now
487,Software Verification Engineer - Student,4,Current Employee,I work at a student lab. Great place to work part time while pursuing a degree. Leadership that is very understanding about school being a priority.,Communication with other Aptiv branches can be sticky,2018, Software Verification Engineer ,1,Software Verification Engineer - Student I work at a student lab. Great place to work part time while pursuing a degree. Leadership that is very understanding about school being a priority. Communication with other Aptiv branches can be sticky
491,So so,2,"Former Employee, more than 10 years",Good for New graduates to get experienced,"Low salary, long working hours, no reepect to loyalty",2019, IT Operations Manager in 陌zmir,0,"So so Good for New graduates to get experienced Low salary, long working hours, no reepect to loyalty"
494,Professional,4,"Current Employee, less than 1 year",1. Very Less Work Pressure 2. Decent Pay 3. Good HR,1. No environment to learn new things,2018, Senior Design Engineer in Chennai,1,Professional 1. Very Less Work Pressure 2. Decent Pay 3. Good HR 1. No environment to learn new things
495,Very good company,4,Former Employee,Good leadership and great colleagues,Frequent ups and downs and temp layoffs,2018,  ,1,Very good company Good leadership and great colleagues Frequent ups and downs and temp layoffs
498,Good job for start,4,"Current Employee, more than 3 years","people, atmosphere, events, benefits, multisport",payment but the rest is ok,2018, Software/Systems Test Engineer in Krak贸w,1,"Good job for start people, atmosphere, events, benefits, multisport payment but the rest is ok"
499,"Run, don't walk to nearest exit.",1,"Former Employee, less than 1 year","Above market pay, good PTO, Troy campus is beautiful.",Layoffs are a common occurrence here so job security is non existent. 400 people were laid off on August 31st with more layoffs in Q4. My new recruiter refuses to work with Aptiv or Delphi to place anybody there due to the constant layoffs. (Wish I knew that before I took the job),2018,"  in Troy, MI",0,"Run, don't walk to nearest exit. Above market pay, good PTO, Troy campus is beautiful. Layoffs are a common occurrence here so job security is non existent. 400 people were laid off on August 31st with more layoffs in Q4. My new recruiter refuses to work with Aptiv or Delphi to place anybody there due to the constant layoffs. (Wish I knew that before I took the job)"
500,What happens in Vegas...,5,"Current Employee, less than 1 year","Salary is very competitive for the area and the cost of living is reasonable, allowing a nice quality of life if you can take the summer heat. Nice to know one can afford to run the A/C and still eat something other than ramen (although there are some terrific noodle places here). Holiday/PTO option is generous when compared to other similar positions in this city and other benefits, such as complimentary snacks/beverages/happy hours, provide additional perks. Casual, comfortable, relaxed dress code is appropriate and much appreciated in the desert. Time off requests are easily approved and having a life outside of work is not just understood, but is actively encouraged.","Extremely rapid growth premature to having functioning support systems in place can cause confusion, especially in new hires who are used to traditional, established, old-school style business . Rapid changes, which seem to be the norm, not the exception, might be difficult for employees who are used to rigid structure, micro-managing and strict schedules. No covered parking for employees.",2018," Vehicle Operator in Las Vegas, NV",1,"What happens in Vegas... Salary is very competitive for the area and the cost of living is reasonable, allowing a nice quality of life if you can take the summer heat. Nice to know one can afford to run the A/C and still eat something other than ramen (although there are some terrific noodle places here). Holiday/PTO option is generous when compared to other similar positions in this city and other benefits, such as complimentary snacks/beverages/happy hours, provide additional perks. Casual, comfortable, relaxed dress code is appropriate and much appreciated in the desert. Time off requests are easily approved and having a life outside of work is not just understood, but is actively encouraged. Extremely rapid growth premature to having functioning support systems in place can cause confusion, especially in new hires who are used to traditional, established, old-school style business . Rapid changes, which seem to be the norm, not the exception, might be difficult for employees who are used to rigid structure, micro-managing and strict schedules. No covered parking for employees."
501,Best company to work,5,"Current Employee, less than 1 year",Nice work environment and friendly co-workers,Under staffed for specific roles including mine.,2018," Salesforce Administrator in Troy, MI",1,Best company to work Nice work environment and friendly co-workers Under staffed for specific roles including mine.
502,Stay away from APTIV chennai office,1,"Former Employee, less than 1 year",No Pros at this company,Saturday working day which will not be communicated during recruitment. they will not allow you to take even 5 leaves in a year.,2019, Senior Engineer in Chennai,0,Stay away from APTIV chennai office No Pros at this company Saturday working day which will not be communicated during recruitment. they will not allow you to take even 5 leaves in a year.
506,Hybrid Systems Engineer,1,Former Employee,"Challenging work and responsibilities. Very capable systems and tools, reference material online. Strong core structure.","Outside Leadership seems to be focused on financials. No longer puts customer or employees as it pillars. Customer Focus is gone, Employee growth and stability is gone. Quality is not focus if it requires investment. Older engineers skating by until retirement. Internal departments no longer working together and instead have to worry about budgets. Sad what this has become.",2018, Anonymous Employee ,0,"Hybrid Systems Engineer Challenging work and responsibilities. Very capable systems and tools, reference material online. Strong core structure. Outside Leadership seems to be focused on financials. No longer puts customer or employees as it pillars. Customer Focus is gone, Employee growth and stability is gone. Quality is not focus if it requires investment. Older engineers skating by until retirement. Internal departments no longer working together and instead have to worry about budgets. Sad what this has become."
507,Senior Financial Analyst,1,"Former Employee, less than 1 year","Competitive pay, hiring process is straightforward, vacation and holiday is comparable to the big 3, and facilities in Troy are modern and clean.","If you have any self-respect, do not work here. The company is highly disorganized. Finance processes are undocumented and adhoc. Management is out to please themselves and will stab you in the back if need be.",2018," Senior Financial Analyst in Troy, MI",0,"Senior Financial Analyst Competitive pay, hiring process is straightforward, vacation and holiday is comparable to the big 3, and facilities in Troy are modern and clean. If you have any self-respect, do not work here. The company is highly disorganized. Finance processes are undocumented and adhoc. Management is out to please themselves and will stab you in the back if need be."
510,Current State,1,"Current Employee, more than 10 years",Product Lines are innovative and high-tech,"Leadership is only concerned with pleasing Wall Street, mergers and acquisitions, and short-term cost cutting at the expense of continuous improvement. People, required skill sets, and basic business fundamentals are not a concern.",2018, Anonymous Employee ,0,"Current State Product Lines are innovative and high-tech Leadership is only concerned with pleasing Wall Street, mergers and acquisitions, and short-term cost cutting at the expense of continuous improvement. People, required skill sets, and basic business fundamentals are not a concern."
512,Driver,2,Current Employee,Great company to be a part with,Not so great company to be a part with,2018, Anonymous Employee ,0,Driver Great company to be a part with Not so great company to be a part with
513,Account Manager,1,Current Employee,They offer good base salary,They do no have a good work life balance,2019, Anonymous Employee ,0,Account Manager They offer good base salary They do no have a good work life balance
516,"it's a job, not a career",2,"Current Employee, more than 10 years","Good pay, flexible work schedule","No opportunity for advancement or even moving to a different job, workforce reductions in order to satisfy investors, complete lack of leadership. I have never before seen an organization where supervisors and managers are clueless about what their employees do. The division in Warren is split in 2 groups- wiring and components. There is no ability to move from one to another - even for posted jobs you apply for.",2018," Engineer in Warren, OH",0,"it's a job, not a career Good pay, flexible work schedule No opportunity for advancement or even moving to a different job, workforce reductions in order to satisfy investors, complete lack of leadership. I have never before seen an organization where supervisors and managers are clueless about what their employees do. The division in Warren is split in 2 groups- wiring and components. There is no ability to move from one to another - even for posted jobs you apply for."
