,Title,Rating,Designation,Pros,Cons,Date,Position,sentiment,all_features
0,Great Culture and Company That Cares,4,Current Employee,Not much politics and very few ego's. Everyone is willing to help which is refreshing. Not very tough recruiting A Player Talent as Aptiv is a place where most want to work.,Need to focus on career growth and promoting within. Not much movement with internal candidates which turns into employees leaving.,2021," Senior Corporate Recruiter in Troy, MI",1,Great Culture and Company That Cares Not much politics and very few ego's. Everyone is willing to help which is refreshing. Not very tough recruiting A Player Talent as Aptiv is a place where most want to work. Need to focus on career growth and promoting within. Not much movement with internal candidates which turns into employees leaving.
1,Shaping the Future of Mobility!,5,"Current Employee, more than 1 year","Global Work Environment, Cutting Edge Technology Sector, Interesting Challenges",None to mention at this time.,2021," Program Manager in Dublin, Dublin",1,"Shaping the Future of Mobility! Global Work Environment, Cutting Edge Technology Sector, Interesting Challenges None to mention at this time."
2,Lots of potential- getting there,4,"Current Employee, more than 1 year","A very fast paced environment - you definitely won't be bored and you learn lots in a short space of time A very global company- exciting to work with some many colleagues from all over the world, if a little daunting at first You can make decisions fast - less bureaucracy that other companies Really nice office facilities, young energetic team of people, good work colleagues.",Training and coaching could be better- high expectations but needs more structure and stability to help people succeed,2021," SCM in Dublin, Dublin",1,"Lots of potential- getting there A very fast paced environment - you definitely won't be bored and you learn lots in a short space of time A very global company- exciting to work with some many colleagues from all over the world, if a little daunting at first You can make decisions fast - less bureaucracy that other companies Really nice office facilities, young energetic team of people, good work colleagues. Training and coaching could be better- high expectations but needs more structure and stability to help people succeed"
5,Black stain on the IDA - Kevin and Joe Show - no encore needed,1,"Current Employee, less than 1 year","The marketing department is great at creating positive reviews on glassdoor. Disregard the obvious fake reviews, challenging work environment is short for toxic and unraveling as a recent million dollar survey announced. Can be hard to get your head around the global scale and complex divisional structures really means aptiv is full of fiefdom, to get anything done you need to follow a broken process using broken systems for no thought out reason for no recognition. Question anything - fired. have an opinion - fired. talk out of turn - fired. try something different - fired. The fear and toxic culture comes from CEO CFO dynamic duo all they way down - the need to impress wall street at all costs means nothing matters only numbers. Culture is a joke there is none. They are Trumpian rip off merchants overpaying themselves to fly all over the world telling people how important they are, Look out for them with their begging bowl in the coming months.",Everything about this place is a con. Dont worry they will be shedding most of the irish workforce soon enough and move onto the next country willing to put up with the Kevin and Joe show.,2020," Financial Analyst in Dublin, Dublin",0,"Black stain on the IDA - Kevin and Joe Show - no encore needed The marketing department is great at creating positive reviews on glassdoor. Disregard the obvious fake reviews, challenging work environment is short for toxic and unraveling as a recent million dollar survey announced. Can be hard to get your head around the global scale and complex divisional structures really means aptiv is full of fiefdom, to get anything done you need to follow a broken process using broken systems for no thought out reason for no recognition. Question anything - fired. have an opinion - fired. talk out of turn - fired. try something different - fired. The fear and toxic culture comes from CEO CFO dynamic duo all they way down - the need to impress wall street at all costs means nothing matters only numbers. Culture is a joke there is none. They are Trumpian rip off merchants overpaying themselves to fly all over the world telling people how important they are, Look out for them with their begging bowl in the coming months. Everything about this place is a con. Dont worry they will be shedding most of the irish workforce soon enough and move onto the next country willing to put up with the Kevin and Joe show."
6,"Bad culture, no HR alignment",1,"Current Employee, more than 3 years","Fairly okay salary, key stakeholders good to work with","HR is all over the place, no centralised HR, global comms are not aligned with local comms, miscommunication, favoritism, no annual bonus, poor incentives for HR team",2021," Human Resources Business Partner HRBP in Dublin, Dublin",0,"Bad culture, no HR alignment Fairly okay salary, key stakeholders good to work with HR is all over the place, no centralised HR, global comms are not aligned with local comms, miscommunication, favoritism, no annual bonus, poor incentives for HR team"
7,Good working place,4,Former Employee,good package comparing to other companies,IT chaos in terms of org and process,2020," Solutions Architect in Dublin, Dublin",1,Good working place good package comparing to other companies IT chaos in terms of org and process
9,Soulless company that grinds you into dust,1,"Current Employee, more than 1 year","Beautiful offices, friendly work colleagues, free coffee and food, central location.","This is the hardest company I've ever worked for - hard not because of the work, but because leadership make loyalty very difficult. I've spent my entire time here constantly wondering if the scheduled meeting with my manager is about me being fired. Honestly, I am only here until they fire me (which could be any day even though I excel in my reviews) or when I find a better job. Aptiv has either fired or lost all the hardworking, competent and talented staff they had in the last six months. Why? Because they are likely showing up their managers by being able to answer the questions and solve the problems they can't. And, of course costs, despite raising the GDP of a small nation in investment in the last quarter. To get a bit of perspective on the culture here: Aptiv's CEO told all staff on a company-wide call that work-life balance was a myth and you should structure your life around Aptiv. Morale is at an all time low. I wasn't experienced in the manufacturing sector prior to joining, and its a cut-throat sector. Aptiv is a manufacturing company trying to pivot into a tech company, but all senior leadership are from the manufacturing sector. American manufacturing management mythologies, everything is about cutting cents, so that the leadership can bolster their stock options.",2020," Corporate Ops in Dublin, Dublin",0,"Soulless company that grinds you into dust Beautiful offices, friendly work colleagues, free coffee and food, central location. This is the hardest company I've ever worked for - hard not because of the work, but because leadership make loyalty very difficult. I've spent my entire time here constantly wondering if the scheduled meeting with my manager is about me being fired. Honestly, I am only here until they fire me (which could be any day even though I excel in my reviews) or when I find a better job. Aptiv has either fired or lost all the hardworking, competent and talented staff they had in the last six months. Why? Because they are likely showing up their managers by being able to answer the questions and solve the problems they can't. And, of course costs, despite raising the GDP of a small nation in investment in the last quarter. To get a bit of perspective on the culture here: Aptiv's CEO told all staff on a company-wide call that work-life balance was a myth and you should structure your life around Aptiv. Morale is at an all time low. I wasn't experienced in the manufacturing sector prior to joining, and its a cut-throat sector. Aptiv is a manufacturing company trying to pivot into a tech company, but all senior leadership are from the manufacturing sector. American manufacturing management mythologies, everything is about cutting cents, so that the leadership can bolster their stock options."
10,Great Company with Progressive Technology,5,"Current Employee, more than 1 year","Rare opportunity in Ireland to work in the automotive manufacturing industry. Genuine career opportunities. The company truly embraces diversity. Strong CEO and sense of being in the right place at the right time. Salary, pension and health benefits above average but bonus is only average. Good social scene, great offices and location, free breakfast, friendly co-workers and some memorable nights out.",Top-heavy management structure. Unfortunately there are too many middle management layers who only have administration/delegation capability rather than hands-on capability and direct experience.,2019, Anonymous Employee ,1,"Great Company with Progressive Technology Rare opportunity in Ireland to work in the automotive manufacturing industry. Genuine career opportunities. The company truly embraces diversity. Strong CEO and sense of being in the right place at the right time. Salary, pension and health benefits above average but bonus is only average. Good social scene, great offices and location, free breakfast, friendly co-workers and some memorable nights out. Top-heavy management structure. Unfortunately there are too many middle management layers who only have administration/delegation capability rather than hands-on capability and direct experience."
11,"""Best place I've ever worked""",4,"Current Employee, less than 1 year",Great place to build new skills. Work with smartest people in the industry. Lots of benefits and competitive pay.,Work life balance. Slow hierarchical progression.,2020," IT Analyst in Dublin, Dublin",1,"""Best place I've ever worked"" Great place to build new skills. Work with smartest people in the industry. Lots of benefits and competitive pay. Work life balance. Slow hierarchical progression."
12,Horrific still having nightmares,1,"Former Employee, more than 1 year",My exit interview as i could see light at the end of the tunnel ,"Micro management, really bad culture as in NO culture. Really showing true colours during Covid forcing people to take holidays and unpaid leave and laying people off redundancies HR totally useless",2020, Finance ,0,"Horrific still having nightmares My exit interview as i could see light at the end of the tunnel  Micro management, really bad culture as in NO culture. Really showing true colours during Covid forcing people to take holidays and unpaid leave and laying people off redundancies HR totally useless"
13,Great,5,"Current Employee, less than 1 year","Great place to work, lots of very talented people working in a complex global environment. Lots of learning opportunities",Can be hard to get your head around the global scale and complex divisional structures.,2019," Anonymous Employee in Dublin, Dublin",1,"Great Great place to work, lots of very talented people working in a complex global environment. Lots of learning opportunities Can be hard to get your head around the global scale and complex divisional structures."
14,Terrible Culture,1,Current Employee,"Interesting technological challenges Diverse infrastructure and requirements, manufacturing, engineering","Terrible challenge Poor management NO leadership Highly political environment Company is doing terribly, many job losses",2020, Enterprise Architect ,0,"Terrible Culture Interesting technological challenges Diverse infrastructure and requirements, manufacturing, engineering Terrible challenge Poor management NO leadership Highly political environment Company is doing terribly, many job losses"
15,Employer review,2,Current Employee,Good to start with new levels,HR policies need extensive revision.,2020, Anonymous Employee ,0,Employer review Good to start with new levels HR policies need extensive revision.
16,"If Carlsberg did bad places to work, they probably wouldn't be as bad as here",1,"Current Employee, more than 1 year","Very little really, many were sold a vision that never actually had c-level commitment behind it. Then people were told that this was never what was said in the first place. There is no forward-thinking going on (at least within the Dublin office). If anyone tries to do something new massive resistance is put in their way and in some cases they are just 'removed' to stop their efforts. They got a large number of very talented people to leave good jobs based on both a large salary jump and a promise of interesting and challenging work, for many the sweet taste of the increased paycheck has well soured since very little of the work they were hired to do ever got a budget or support to proceed. So Pros: You might get a salary bump, but you'll regret it nearly instantly. The location is very good. The building is great if you want to 'look' like you work in a modern company.","Where to start. Basics: No parking, no stock for normal employees, exceptionally poor leadership, nearly everything is out-sourced. For Dublin in particular, pretending to be Corporate HQ is a joke, as a site it is so removed from the actual activities of the wider company it may as well be a call center. No culture, in fact, the employees recently got the blame for a bad culture score, the remedy? Hold an all-hands where we were told ""Go make a better culture"", this must be the only improvement program they haven't out-sourced, which goes to show how much they care about that. Relocated numerous staff members from various countries only to now make a sizable number of them redundant, very classy move. Hire numerous talented IT professionals than not support them either by connecting them with the wider company or budgeting for the work they were hired to do. Sack people who rocked the apple cart and actually started to make a difference across many functions IT, SCM and Finance.",2019," IT in Dublin, Dublin",0,"If Carlsberg did bad places to work, they probably wouldn't be as bad as here Very little really, many were sold a vision that never actually had c-level commitment behind it. Then people were told that this was never what was said in the first place. There is no forward-thinking going on (at least within the Dublin office). If anyone tries to do something new massive resistance is put in their way and in some cases they are just 'removed' to stop their efforts. They got a large number of very talented people to leave good jobs based on both a large salary jump and a promise of interesting and challenging work, for many the sweet taste of the increased paycheck has well soured since very little of the work they were hired to do ever got a budget or support to proceed. So Pros: You might get a salary bump, but you'll regret it nearly instantly. The location is very good. The building is great if you want to 'look' like you work in a modern company. Where to start. Basics: No parking, no stock for normal employees, exceptionally poor leadership, nearly everything is out-sourced. For Dublin in particular, pretending to be Corporate HQ is a joke, as a site it is so removed from the actual activities of the wider company it may as well be a call center. No culture, in fact, the employees recently got the blame for a bad culture score, the remedy? Hold an all-hands where we were told ""Go make a better culture"", this must be the only improvement program they haven't out-sourced, which goes to show how much they care about that. Relocated numerous staff members from various countries only to now make a sizable number of them redundant, very classy move. Hire numerous talented IT professionals than not support them either by connecting them with the wider company or budgeting for the work they were hired to do. Sack people who rocked the apple cart and actually started to make a difference across many functions IT, SCM and Finance."
17,Stay clear of this company,1,Former Employee,"Some good people, all struggling to survive such a toxic environment","Toxic culture primarily due to leadership team. Employees are not valued. No recognition, appreciation or support. All are disposable widgets to be used and then discarded.",2019, Anonymous Employee ,0,"Stay clear of this company Some good people, all struggling to survive such a toxic environment Toxic culture primarily due to leadership team. Employees are not valued. No recognition, appreciation or support. All are disposable widgets to be used and then discarded."
18,"Going about as well as Brexit really, isnt't it?",1,Current Employee,"shiny new office (fancy fingerprint sign-in doesnt always work) , handy to DART. that's about it really....","let's face it, it's going about as well as Brexit. Weak , inexperienced US managment on their first international assignment are out of their depth and struggling. Supply chain , finance and tax are complete losses- just stay clear of them .......",2019," Supply Chain Manager in Dublin, Dublin",0,"Going about as well as Brexit really, isnt't it? shiny new office (fancy fingerprint sign-in doesnt always work) , handy to DART. that's about it really.... let's face it, it's going about as well as Brexit. Weak , inexperienced US managment on their first international assignment are out of their depth and struggling. Supply chain , finance and tax are complete losses- just stay clear of them ......."
19,"Cutting edge on Automotive Technology, Better Than Average Benefits and Pay",4,"Current Employee, more than 1 year",The environment is changing to become more a of software development company and focus on next generation automotive solutions for the brain and nervous system of the automobile. Great people to work with.,"Very demanding management teams to get more done in an environment with constant change, turnover, and knowledge gaps.",2019," IT Business Relationship Manager in Dublin, Dublin",1,"Cutting edge on Automotive Technology, Better Than Average Benefits and Pay The environment is changing to become more a of software development company and focus on next generation automotive solutions for the brain and nervous system of the automobile. Great people to work with. Very demanding management teams to get more done in an environment with constant change, turnover, and knowledge gaps."
20,Rebranded as a tech company but really a Dinosaur. Stay away.,1,"Former Employee, less than 1 year","Good salaries, Nice office location in Grand Canal Dock","Too much red tape, Slow decision making, Very Hierarchical. Weak senior staff",2019," IT Consultant in Dublin, Dublin",0,"Rebranded as a tech company but really a Dinosaur. Stay away. Good salaries, Nice office location in Grand Canal Dock Too much red tape, Slow decision making, Very Hierarchical. Weak senior staff"
21,APTIV Ireland,5,"Current Employee, more than 1 year",Great Culture Generous Package Good Working Environment Lots of OpportunitiesAPTIV,Pace can be hectic at times Priorities can shift quickly with little warning,2019," IT Director in Dublin, Dublin",1,APTIV Ireland Great Culture Generous Package Good Working Environment Lots of OpportunitiesAPTIV Pace can be hectic at times Priorities can shift quickly with little warning
22,good so far,4,"Current Employee, more than 1 year",Interesting growing company lots of opportunities,"very complex ,jobs very specialised",2019," IT Architect in Dublin, Dublin",1,"good so far Interesting growing company lots of opportunities very complex ,jobs very specialised"
23,not for everyone,2,"Current Employee, less than 1 year","Remuneration for some levels, could get a decent manager. Interesting work and loads of responsibility.","Remuneration often not worth it, no matter how much. Finance and tax function is mad. Senior management can be counter productive and drive away people or minimises motivation. Unrealistic expectations and approach from certain leaders creates uncomfortable workplace.",2018," Anonymous Employee in Dublin, Dublin",0,"not for everyone Remuneration for some levels, could get a decent manager. Interesting work and loads of responsibility. Remuneration often not worth it, no matter how much. Finance and tax function is mad. Senior management can be counter productive and drive away people or minimises motivation. Unrealistic expectations and approach from certain leaders creates uncomfortable workplace."
24,Finance,1,"Former Employee, less than 1 year","Good Salary, Nice Offices, Work Interesting, and varied, opportunities to travel depending on area of business you are in, some of the people are inclusive","HR unsophisticated not strategic, staff are a number treated badly, staff under huge pressure to deliver to unrealistic deadlines, Dublin corp office hiring and firing within 11 month probation period pulling people out of secure jobs then dumping them callously, no management structures in place, a lot of shouting, staff distressed within months of being there, American managers think they are in US not Ireland using US practices a lawsuit waiting to happen",2018," Anonymous Employee in Dublin, Dublin",0,"Finance Good Salary, Nice Offices, Work Interesting, and varied, opportunities to travel depending on area of business you are in, some of the people are inclusive HR unsophisticated not strategic, staff are a number treated badly, staff under huge pressure to deliver to unrealistic deadlines, Dublin corp office hiring and firing within 11 month probation period pulling people out of secure jobs then dumping them callously, no management structures in place, a lot of shouting, staff distressed within months of being there, American managers think they are in US not Ireland using US practices a lawsuit waiting to happen"
25,Mistake,2,Current Employee,"Looks decent externally, pretend to be part of the future.","Not a technology company. Sterile office environment. Unreasonable expectations. Rough, micro-managing senior leadership, especially within Finance. Monolithic culture that does not seem to embrace differences. People are angry and disengaged. Lots of screamers. Work for the sake of work, which creates constant swirl.",2018," Anonymous Employee in Dublin, Dublin",0,"Mistake Looks decent externally, pretend to be part of the future. Not a technology company. Sterile office environment. Unreasonable expectations. Rough, micro-managing senior leadership, especially within Finance. Monolithic culture that does not seem to embrace differences. People are angry and disengaged. Lots of screamers. Work for the sake of work, which creates constant swirl."
26,FLDP,5,Current Employee,Great exposure to different roles in the global corporation.,Be able to move every year arround the world.,2018, Anonymous Employee ,1,FLDP Great exposure to different roles in the global corporation. Be able to move every year arround the world.
27,Stay Clear,1,"Former Employee, less than 1 year",Very little...some nice people but thats about it,No work life balance...managers rule by fear....unreasonable expectations,2019," Anonymous Employee in Dublin, Dublin",0,Stay Clear Very little...some nice people but thats about it No work life balance...managers rule by fear....unreasonable expectations
28,A rolling start.....,5,"Current Employee, less than 1 year","Exciting product offering, very direct, positive, open culture, right to CX level. Excellent support from HR and management teams. Huge potential for growth as a company and personally.","None! There are always issues with companies going through significant change, but at Aptiv, theyre very good at getting out in front of them and communicating clearly, there really are no issues that arent acknowledged and being addressed at pace.",2018," IT Director in Dublin, Dublin",1,"A rolling start..... Exciting product offering, very direct, positive, open culture, right to CX level. Excellent support from HR and management teams. Huge potential for growth as a company and personally. None! There are always issues with companies going through significant change, but at Aptiv, theyre very good at getting out in front of them and communicating clearly, there really are no issues that arent acknowledged and being addressed at pace."
29,Good Company to work for. Wonderful atmosphere and flexible work life balance. Flexible work life balance,5,"Current Employee, less than 1 year",Very good relocation package. Good Exposure . Senior Leadership is always available for any inputs/feedback. Perks Benefits Good Compensation Challenging roles but based upon individual interest Diverse Culture,No share purchase plan Dependency on suppliers,2018," Senior Manager in Dublin, Dublin",1,Good Company to work for. Wonderful atmosphere and flexible work life balance. Flexible work life balance Very good relocation package. Good Exposure . Senior Leadership is always available for any inputs/feedback. Perks Benefits Good Compensation Challenging roles but based upon individual interest Diverse Culture No share purchase plan Dependency on suppliers
