,Title,Rating,Designation,Pros,Cons,Date,Position,sentiment,all_features
244,"Great people, questionable leadership",2,"Former Employee, more than 1 year","This review is subjected to the Allen Park office ONLY. Aptiv acquired Control-Tec, who was great and where most of the pros stem from. Note that other offices have completely different cultures/benefits. - Great people to work with, culture is about making sure everyone is on the same page and just wants to build something great. Teamwork is a non-issue. PMs and devs are your partners through and through. - Cross-functional folks and users are amazing and kind people. Very passionate about their work and willing to help you as much as they can, whether it's teaching, including, and giving constructive feedback. - WLB is great, though once in a while a push is needed to deliver, and with take-as-you-need/unlimited vacation, you can't get better than that (Allen Park office only). - Culture events like board/video game nights, whiskey/beer guilds, bbq days, and food truck summers were plentiful at the Allen Park office.","- Management are often at a disconnect with upper management/leadership strategies, which gets worse at IC level. After Aptiv acquisition, product teams including SME experts were unsure/unconfident about the product they were asked to build. Validation and justifying product decisions/directions was a constant sore point between product and upper management. - Be prepared to be the only UX resource across multiple products/PM's. Once the ratio was 1 UX : 7 PMs : 30+ developers. Be prepared to brutally prioritize and deliver what you can. You are also a PM, but the pay won't reflect this. - During COVID-19, Allen Park Aptiv quietly laid people off after leadership made assurances of that not being the case. 2 months later, and right after 6 weeks of furloughs, layoffs ensued. Roles including mine and high-performing software engineers were affected.",2020," User Experience Designer in Allen Park, MI",0,"Great people, questionable leadership This review is subjected to the Allen Park office ONLY. Aptiv acquired Control-Tec, who was great and where most of the pros stem from. Note that other offices have completely different cultures/benefits. - Great people to work with, culture is about making sure everyone is on the same page and just wants to build something great. Teamwork is a non-issue. PMs and devs are your partners through and through. - Cross-functional folks and users are amazing and kind people. Very passionate about their work and willing to help you as much as they can, whether it's teaching, including, and giving constructive feedback. - WLB is great, though once in a while a push is needed to deliver, and with take-as-you-need/unlimited vacation, you can't get better than that (Allen Park office only). - Culture events like board/video game nights, whiskey/beer guilds, bbq days, and food truck summers were plentiful at the Allen Park office. - Management are often at a disconnect with upper management/leadership strategies, which gets worse at IC level. After Aptiv acquisition, product teams including SME experts were unsure/unconfident about the product they were asked to build. Validation and justifying product decisions/directions was a constant sore point between product and upper management. - Be prepared to be the only UX resource across multiple products/PM's. Once the ratio was 1 UX : 7 PMs : 30+ developers. Be prepared to brutally prioritize and deliver what you can. You are also a PM, but the pay won't reflect this. - During COVID-19, Allen Park Aptiv quietly laid people off after leadership made assurances of that not being the case. 2 months later, and right after 6 weeks of furloughs, layoffs ensued. Roles including mine and high-performing software engineers were affected."
245,Project leader for Daimler,4,"Current Employee, more than 3 years","Dynamic, good team, interesting project",A lot of overtime works.,2020, Plant Support Engineer in Novi Sad,1,"Project leader for Daimler Dynamic, good team, interesting project A lot of overtime works."
246,Okay,4,"Current Employee, more than 5 years",No work pressure. Sit back and relax like government office.,"Worst Management, micro management of employees. No diversity.",2020, Engineer in Chennai,1,"Okay No work pressure. Sit back and relax like government office. Worst Management, micro management of employees. No diversity."
247,good money but terrible culture,2,"Former Employee, more than 8 years",pay plus benefits - big cars,the culture does not respect the basic values,2020, Sales Manager in Berlin,0,good money but terrible culture pay plus benefits - big cars the culture does not respect the basic values
248,Great place to work,4,"Current Employee, more than 3 years",*Company with great vision *Great learning & Challenging work *Supportive manager & Team *Better work life balance * Decent pay acc to current market rate,"* Facility should be improved - canteen, parking, Wellness room etc.",2020, Senior Software Engineer ,1,"Great place to work *Company with great vision *Great learning & Challenging work *Supportive manager & Team *Better work life balance * Decent pay acc to current market rate * Facility should be improved - canteen, parking, Wellness room etc."
249,Great for a start,4,"Former Employee, less than 1 year","Great atmosphere, modern hardware, ability to extend your knowledge, remote work during the pandemic","Low pay for students, often repetitive tasks",2020, Student QA Tester ,1,"Great for a start Great atmosphere, modern hardware, ability to extend your knowledge, remote work during the pandemic Low pay for students, often repetitive tasks"
250,Best Company to be,5,Current Employee,This company provide the best remuneration.,Not really good is limited parking area.,2020, Human Resources Supervisor in Kuala Terengganu,1,Best Company to be This company provide the best remuneration. Not really good is limited parking area.
252,Great place,4,Former Employee,great pay friendly work environment,confusing work environment management seems lost,2020, Lab Technician ,1,Great place great pay friendly work environment confusing work environment management seems lost
253,A radar company failing to be a tech company,1,"Current Employee, more than 3 years","Flexible work hours, little expectations",Management doesn't know how to make or sell software,2021," Software Engineer in Indianapolis, IN",0,"A radar company failing to be a tech company Flexible work hours, little expectations Management doesn't know how to make or sell software"
254,Executive,1,Former Employee,"Company Portfolio , the people working in mid level jobs keeping it going daily! The quality of products","Top Managment , & Culture, lack of true diversity and treatment of people that work there, work life balance, focus on cost vs growth, top management is a boys club, believes US workers are too expensive and older workers need to go; does not value loyalty",2020," Executive Director in America, IL",0,"Executive Company Portfolio , the people working in mid level jobs keeping it going daily! The quality of products Top Managment , & Culture, lack of true diversity and treatment of people that work there, work life balance, focus on cost vs growth, top management is a boys club, believes US workers are too expensive and older workers need to go; does not value loyalty"
255,Good company,4,Current Employee,Many opportunities to be successful at Aptiv if youre hardworking and like to be involved with continuous improvement. Total rewards package is very good.,Very siloed company with much duplication. Value OneTeam is aspirational versus reality.,2020, Director ,1,Good company Many opportunities to be successful at Aptiv if youre hardworking and like to be involved with continuous improvement. Total rewards package is very good. Very siloed company with much duplication. Value OneTeam is aspirational versus reality.
256,Very good working condition,5,"Current Employee, more than 3 years",Good working condition in plant,System not use many time in plant,2020, Industrial Engineering ,1,Very good working condition Good working condition in plant System not use many time in plant
257,Overall good.,4,"Former Employee, more than 3 years",opportunity to work with interesting automotive projects.,As usual in corp. Sometimes much work due to cumulative tasks.,2020, Software/Systems Test Engineer in Krak贸w,1,Overall good. opportunity to work with interesting automotive projects. As usual in corp. Sometimes much work due to cumulative tasks.
258,Enjoy the challenges and coworkers,4,Current Employee,"Challenging job Great, knowledgeable coworkers Opportunities for growth",The company is too big Bureaucracy,2020," Program Manager in Allen Park, MI",1,"Enjoy the challenges and coworkers Challenging job Great, knowledgeable coworkers Opportunities for growth The company is too big Bureaucracy"
259,Nice place for start,4,"Current Employee, more than 5 years","Interesting projects, People, Nice office","Salary, Corporate style, Mngment, Methodologies",2020, Technical Manager in Krak贸w,1,"Nice place for start Interesting projects, People, Nice office Salary, Corporate style, Mngment, Methodologies"
260,Nice place for start,4,"Current Employee, more than 5 years","Interesting projects, People, Nice office","Salary, Corporate style, Mngment, Methodologies",2020, Technical Manager in Krak贸w,1,"Nice place for start Interesting projects, People, Nice office Salary, Corporate style, Mngment, Methodologies"
261,Work review,5,Current Employee,Good place for Automotive embedded systems Engineers,None nothing really bothered me,2020, Software Engineer ,1,Work review Good place for Automotive embedded systems Engineers None nothing really bothered me
262,Benefits,4,"Current Employee, more than 3 years","Good benefits, time off etc.",Constant changes in employee turn around,2020, Project Manager in Krak贸w,1,"Benefits Good benefits, time off etc. Constant changes in employee turn around"
264,Good experience,4,Current Employee,"Good conditions , atmosphere and management","Hard to get promoted, no benefits",2020, Anonymous Employee in Bangalore,1,"Good experience Good conditions , atmosphere and management Hard to get promoted, no benefits"
265,Great team,5,"Former Employee, more than 3 years","Good work enviroment, good salary",No negative feedback for this company,2020," IT Supervisor, Technical Support in Warren, OH",1,"Great team Good work enviroment, good salary No negative feedback for this company"
266,Very good,5,"Former Employee, more than 1 year",It is a very good work place,I dont have any cons,2020," Design/BOM Engineer in Hillsboro, OR",1,Very good It is a very good work place I dont have any cons
267,Nice place to work,5,"Former Employee, more than 3 years",They ensure the Job Security and the work environment is also good,Facilities can be improved bit more,2020," Senior Software Engineer in Chandler, AZ",1,Nice place to work They ensure the Job Security and the work environment is also good Facilities can be improved bit more
268,Review headline,4,Former Employee,Challenging work & very nice colleagues,Slow management decisions Bad canteen and food,2020, Senior Technical Lead in rebro,1,Review headline Challenging work & very nice colleagues Slow management decisions Bad canteen and food
270,Lost Focus on Manufacturing,4,"Former Employee, more than 10 years",Global Company with an innovative working team,Sr. Management has lost focus on manufacturing and it could have a negative impact in the long term,2020, Anonymous Employee ,1,Lost Focus on Manufacturing Global Company with an innovative working team Sr. Management has lost focus on manufacturing and it could have a negative impact in the long term
271,work,5,"Former Employee, more than 3 years","It was my first job out of college, and I liked most of the people I worked with. I got to work on some interesting stuff.","There was a big age gap when I got hired, as most of the engineers had been there pre ~2008 crash. There was a period there where the company took on a more projects that its personnel count could support, so there was a good chunk of salaried overtime.",2020," Systems Engineer in Troy, MI",1,"work It was my first job out of college, and I liked most of the people I worked with. I got to work on some interesting stuff. There was a big age gap when I got hired, as most of the engineers had been there pre ~2008 crash. There was a period there where the company took on a more projects that its personnel count could support, so there was a good chunk of salaried overtime."
273,Good company,4,Current Employee,Work environment is good and this is excellent opportunity to learn about future mobility.,It is hard to balance between work and life.,2020, Senior Engineer ,1,Good company Work environment is good and this is excellent opportunity to learn about future mobility. It is hard to balance between work and life.
278,A company under transformation,4,"Current Employee, less than 1 year","If you like challenges, and change Aptiv is the place for you, the company right now is evolving from being a pure manufacturing company to become an Industrial Tech one, developing technology that can make vehicles safer and more connected. Aptiv genuinely cares for people",There is constant change in the company as part of the transformation.,2020," Anonymous Employee in Troy, MI",1,"A company under transformation If you like challenges, and change Aptiv is the place for you, the company right now is evolving from being a pure manufacturing company to become an Industrial Tech one, developing technology that can make vehicles safer and more connected. Aptiv genuinely cares for people There is constant change in the company as part of the transformation."
280,"Poor company culture, poor management, constant organisational changes",1,"Current Employee, more than 1 year",Relaxed work environment. Interesting technologies to work on. Friendly people.,"Quite a lot of hypocrisy and discrimination when it comes to salary and roles (but also getting a job). This is specific to HR, but not only. Very difficult to get a job offer without an internal referral. Micromanagement at all levels. Slow decision making process, decisions often overturned.",2020," Anonymous Employee in Aliso Viejo, CA",0,"Poor company culture, poor management, constant organisational changes Relaxed work environment. Interesting technologies to work on. Friendly people. Quite a lot of hypocrisy and discrimination when it comes to salary and roles (but also getting a job). This is specific to HR, but not only. Very difficult to get a job offer without an internal referral. Micromanagement at all levels. Slow decision making process, decisions often overturned."
281,"Good Company, Good Learning Opportunity",4,"Current Employee, more than 1 year",1. Work culture is quite open and almost like a startup 2. Great learning opportunity if you are willing to learn 3. Freedom to develop new things and experiment,Salaries should be higher. Need to standardize certain work protocols,2020," ADAS Algorithm Developer in Columbus, OH",1,"Good Company, Good Learning Opportunity 1. Work culture is quite open and almost like a startup 2. Great learning opportunity if you are willing to learn 3. Freedom to develop new things and experiment Salaries should be higher. Need to standardize certain work protocols"
283,Good company,5,Current Employee,very friendly co-workers and challenging task to keep you motivated,none from my experience working at Aptiv,2020, Anonymous Employee ,1,Good company very friendly co-workers and challenging task to keep you motivated none from my experience working at Aptiv
284,Good opportunities to learn,5,"Former Employee, more than 5 years","Self learning, and opportunity to move within the company",Salaries are not competitive in comparison.,2020, CAE Engineer in Bursa,1,"Good opportunities to learn Self learning, and opportunity to move within the company Salaries are not competitive in comparison."
285,"Best Company in automotive, offers good package to employees",5,"Current Employee, more than 3 years","Nice place for work, supportive staff.",Nothing to mention here right now,2020, Senior Software Engineer in Bangalore,1,"Best Company in automotive, offers good package to employees Nice place for work, supportive staff. Nothing to mention here right now"
286,environment is all about politics,2,"Current Employee, more than 1 year","good place for people just want to get paid, doesn't matter if you can do the work or not as long as you got hired here","the direction of how to do self-driving car is wrong here, already falls behind the industry, but the marketing is really good at bluffing, and makes its stock price looks pretty good. But this is not good for your career path, and you will find your skills are mostly out of date in the related industry.",2020, Algorithm Engineer ,0,"environment is all about politics good place for people just want to get paid, doesn't matter if you can do the work or not as long as you got hired here the direction of how to do self-driving car is wrong here, already falls behind the industry, but the marketing is really good at bluffing, and makes its stock price looks pretty good. But this is not good for your career path, and you will find your skills are mostly out of date in the related industry."
288,Work Life Balance,4,Current Employee,good Work Life Balance and for career growth,nothing to be updated now,2020, Anonymous Employee ,1,Work Life Balance good Work Life Balance and for career growth nothing to be updated now
289,Good learning experience,4,Current Employee,"Good learning experience, got opportunity to explore different areas",Nothing that has till date,2020," Software Engineer in Detroit, MI",1,"Good learning experience Good learning experience, got opportunity to explore different areas Nothing that has till date"
290,Good Company for Freshers with attractive incentives,4,"Current Employee, more than 3 years",1) Attractive Incentives 2) Good Heath Benefit Insurance 3) Good 401K Match 4) Friendly Work Culture,1) Frequent Management Changes 2) Unstable Hierarchy stack 3) Unpredictable Management decisions 4) Middle Layer Management Issues,2020," Systems Engineer in Troy, MI",1,Good Company for Freshers with attractive incentives 1) Attractive Incentives 2) Good Heath Benefit Insurance 3) Good 401K Match 4) Friendly Work Culture 1) Frequent Management Changes 2) Unstable Hierarchy stack 3) Unpredictable Management decisions 4) Middle Layer Management Issues
292,ok,4,Former Employee,"good working environment, food, poeple","management, salary, projection, life-work, shifts",2020, Anonymous Employee ,1,"ok good working environment, food, poeple management, salary, projection, life-work, shifts"
293,Good company to work at,4,"Former Employee, more than 3 years","Lots of benefits (medical,dental,etc) Access to many new technologies.",Management could be a bit toxic sometimes.,2020, Anonymous Employee ,1,"Good company to work at Lots of benefits (medical,dental,etc) Access to many new technologies. Management could be a bit toxic sometimes."
294,Experience ok,4,Former Employee,transport was provided by company,no growth opportunity in the company location,2020, Manufacturing Engineer in Timioara,1,Experience ok transport was provided by company no growth opportunity in the company location
295,Nice,4,Former Employee,Nice industry and working on popular area,Nothing special to complain about,2020," Internship in Boston, MA",1,Nice Nice industry and working on popular area Nothing special to complain about
296,Software Engineering at Aptiv MTC,5,"Current Employee, more than 5 years","Flexible hours, great team and staff, interesting work.",Not the best paying company in the field.,2020, Embedded Software Engineer in Ciudad Juarez,1,"Software Engineering at Aptiv MTC Flexible hours, great team and staff, interesting work. Not the best paying company in the field."
297,Good learning but hard work,4,"Former Employee, more than 5 years",Good process and skilled employees,Process implementation gaps and work pressure,2020, Assistant Manager Supply Chain in Pune,1,Good learning but hard work Good process and skilled employees Process implementation gaps and work pressure
298,Good place to work,4,"Current Employee, more than 1 year","Very friendly people all around, suppose if you get stuck people will help you for sure","Accept the things and go, that's it if you love your work.",2020, Anonymous Employee ,1,"Good place to work Very friendly people all around, suppose if you get stuck people will help you for sure Accept the things and go, that's it if you love your work."
300,Good management,4,"Current Employee, less than 1 year","Good management, cooperative teams and transparency",Not a high salary in Poland,2020, Embedded Software Engineer in Krak贸w,1,"Good management Good management, cooperative teams and transparency Not a high salary in Poland"
301,good,4,"Former Employee, more than 3 years",good learning there at aptiv,no visibility to the upper managment,2020, Anonymous Employee ,1,good good learning there at aptiv no visibility to the upper managment
302,Software Developer,4,"Former Employee, more than 1 year","Great group of people, company sponsored events",Time off difficult to navigate with work load but encourage to take,2020," Software Developer in Allen Park, MI",1,"Software Developer Great group of people, company sponsored events Time off difficult to navigate with work load but encourage to take"
303,Bittersweet experience,4,"Current Employee, more than 5 years",Compensation 401k matching upto 7.5% Work-Life Balance Abreast with latest technology trends Co-operative and collaborating culture,Work location Lengthy project execution Hiring low quality employees during hiring sprees,2020," Senior Hardware Engineer in Kokomo, IN",1,Bittersweet experience Compensation 401k matching upto 7.5% Work-Life Balance Abreast with latest technology trends Co-operative and collaborating culture Work location Lengthy project execution Hiring low quality employees during hiring sprees
306,Great Benefits,5,Former Employee,Aptiv has great benefits and very understanding of work-life balance,None that I can think of!,2020, Talent Acquisition ,1,Great Benefits Aptiv has great benefits and very understanding of work-life balance None that I can think of!
307,Tough Environment,2,Former Employee,"Pay is very competitive, Interesting Work","Benefits, Workplace Culture, Regular Restructuring",2020, Corporate Manager ,0,"Tough Environment Pay is very competitive, Interesting Work Benefits, Workplace Culture, Regular Restructuring"
308,Great learning experience,5,"Current Employee, more than 1 year",Get to learn a lot. You feel contributing a lot. Worklife balance,Not enough fun activities conducted at office,2020," Software Engineer in Troy, MI",1,Great learning experience Get to learn a lot. You feel contributing a lot. Worklife balance Not enough fun activities conducted at office
309,Good 401k benefits,4,"Current Employee, more than 1 year",Good 401k benefits and good pay. Provides relocation assistance.,Sometimes you have to work late due to software releases and testing activities,2020," Software Engineer in Troy, MI",1,Good 401k benefits Good 401k benefits and good pay. Provides relocation assistance. Sometimes you have to work late due to software releases and testing activities
310,Program Manager,4,"Current Employee, more than 5 years",Good strategic direction of the company,Lot of internal changes in the company,2020," Program Manager in Detroit, MI",1,Program Manager Good strategic direction of the company Lot of internal changes in the company
311,Great company,4,Former Employee,Very chill and laid back work environment.,The salary was a bit lower than expected.,2020, Hardware Engineer ,1,Great company Very chill and laid back work environment. The salary was a bit lower than expected.
313,Active Safety / User Experience,4,"Former Employee, more than 10 years",Leading tech in growing areas of the automotive industry with lots of potential. Lots of talented people and opportunity to work with people from around the globe with varying ideas & perspectives.,"Management silos created road blocks and duplicate efforts that didn't align with other group efforts & management not being transparent with employees about future business path. They don't value experienced people as they should but rather employ lower cost entry level people. I predict closing the North American Infotainment & Driver Interface business will be a mistake in the long run, when historically it was always profitable for the company. But Autonomous & related Software/Services are now their only focus.",2020," Anonymous Employee in Kokomo, IN",1,"Active Safety / User Experience Leading tech in growing areas of the automotive industry with lots of potential. Lots of talented people and opportunity to work with people from around the globe with varying ideas & perspectives. Management silos created road blocks and duplicate efforts that didn't align with other group efforts & management not being transparent with employees about future business path. They don't value experienced people as they should but rather employ lower cost entry level people. I predict closing the North American Infotainment & Driver Interface business will be a mistake in the long run, when historically it was always profitable for the company. But Autonomous & related Software/Services are now their only focus."
