,Title,Rating,Designation,Pros,Cons,Date,Position,sentiment,all_features
97,Great Culture and Company That Cares,4,Current Employee,Not much politics and very few ego's. Everyone is willing to help which is refreshing. Not very tough recruiting A Player Talent as Aptiv is a place where most want to work.,Need to focus on career growth and promoting within. Not much movement with internal candidates which turns into employees leaving.,2021," Senior Corporate Recruiter in Troy, MI",1,Great Culture and Company That Cares Not much politics and very few ego's. Everyone is willing to help which is refreshing. Not very tough recruiting A Player Talent as Aptiv is a place where most want to work. Need to focus on career growth and promoting within. Not much movement with internal candidates which turns into employees leaving.
98,Cool Workplace!,5,"Current Employee, more than 3 years","Work Life Balance, Helpful colleagues, decent pay, great atmosphere, good learning opportunity","No major cons, sometimes the workload is more",2021, Software Quality Engineer in Wuppertal,1,"Cool Workplace! Work Life Balance, Helpful colleagues, decent pay, great atmosphere, good learning opportunity No major cons, sometimes the workload is more"
99,Good place to work,5,"Former Employee, more than 5 years",It is a good place to work. Very diverse work group,Lots of positions moved to other countries,2021," Senior CAD Designer in Troy, MI",1,Good place to work It is a good place to work. Very diverse work group Lots of positions moved to other countries
100,R&D for automotive,5,Current Employee,"Nice team, interesting technologies, development opportunities.",High velocity of everyday work.,2021, Technical Lead in Krak贸w,1,"R&D for automotive Nice team, interesting technologies, development opportunities. High velocity of everyday work."
101,SoftwareEngineer,1,Current Employee,salary is ok in mideast,Lack of team building activity,2021," Senior Embedded Software Engineer in Kokomo, IN",0,SoftwareEngineer salary is ok in mideast Lack of team building activity
105,Good for Learning,4,"Former Employee, more than 3 years","Lots of work, good in the learning phase of career","Poor Management, Management has to improve. Still a company with old mindset",2021, Advanced Software Developer in Bangalore,1,"Good for Learning Lots of work, good in the learning phase of career Poor Management, Management has to improve. Still a company with old mindset"
109,Very bad management,1,Current Employee,Good work for learning .,"1. No work life balance 2. People work 24/7 in this company 3. Ask everytime to work on weekends 4. No management to check your workload,they just give deadline 5. Very bad food 6. No seating arrangements 7. Give any competency work to anyone and suppose to give output as expert",2021, Advanced Software Developer ,0,"Very bad management Good work for learning . 1. No work life balance 2. People work 24/7 in this company 3. Ask everytime to work on weekends 4. No management to check your workload,they just give deadline 5. Very bad food 6. No seating arrangements 7. Give any competency work to anyone and suppose to give output as expert"
110,Very bad management,1,Current Employee,Good work for learning .,"1. No work life balance 2. People work 24/7 in this company 3. Ask everytime to work on weekends 4. No management to check your workload,they just give deadline 5. Very bad food 6. No seating arrangements 7. Give any competency work to anyone and suppose to give output as expert",2021, Advanced Software Developer ,0,"Very bad management Good work for learning . 1. No work life balance 2. People work 24/7 in this company 3. Ask everytime to work on weekends 4. No management to check your workload,they just give deadline 5. Very bad food 6. No seating arrangements 7. Give any competency work to anyone and suppose to give output as expert"
111,NICE,4,"Current Employee, more than 3 years","Open working environment and knowledge sharing,","always too much work need to finish at the same time, need the overtime work without payment.",2021," Algorithm Engineer in Suzhou, Jiangsu, Jiangsu",1,"NICE Open working environment and knowledge sharing, always too much work need to finish at the same time, need the overtime work without payment."
112,Good company to work,4,Current Employee,Exciting projects to work on,Organizational skills are not up to the mark,2021, Anonymous Employee ,1,Good company to work Exciting projects to work on Organizational skills are not up to the mark
113,Great,4,"Current Employee, more than 1 year","Great projects, good place to learn new stuff",Company is not well organised,2021, BI Developer in Krak贸w,1,"Great Great projects, good place to learn new stuff Company is not well organised"
114,Good to work,4,"Former Employee, more than 1 year",Good learning curve Good Projects Good Management,Less Salary Less benefits No work life balance,2021," Software Test Engineer in Troy, MI",1,Good to work Good learning curve Good Projects Good Management Less Salary Less benefits No work life balance
115,Bad company,1,"Former Employee, more than 1 year","Not that I can think of, noup.","Small salary, no paid overtime, and night shifts.",2021, Driver/Forklift Operator and Cargo Handler ,0,"Bad company Not that I can think of, noup. Small salary, no paid overtime, and night shifts."
116,Great atmosphere,5,"Former Employee, more than 1 year",Leadership always improving and considering employees. Provided support during COVID. Always conducting survey to get employees opinion.,Not easy to find the right person that knows what you are trying to solve but have to do some searching.,2021, Software Engineer in Gothenburg,1,Great atmosphere Leadership always improving and considering employees. Provided support during COVID. Always conducting survey to get employees opinion. Not easy to find the right person that knows what you are trying to solve but have to do some searching.
117,Greate working Enviroment,5,Current Employee,"flat & flex organization, quick response, quick action",not very sure about this,2021, Technical Manager in Tokyo,1,"Greate working Enviroment flat & flex organization, quick response, quick action not very sure about this"
118,"Excellent Company, great people focus",5,"Current Employee, more than 10 years","Quality of work, people caring, innovation",Little bit work life balance,2021, Chief Engineer in Bangalore,1,"Excellent Company, great people focus Quality of work, people caring, innovation Little bit work life balance"
119,Aptiv Born To Move,4,"Current Employee, more than 10 years",Great place to work and learn in leading automotive technology,No concerns on Aptiv Bangalore,2021, Engineering in Bangalore,1,Aptiv Born To Move Great place to work and learn in leading automotive technology No concerns on Aptiv Bangalore
120,Was a great team,5,"Former Employee, more than 1 year",None that are worth the headache.,- Had a lot of corporate bloat software that was complex and difficult to manage what was important and what wasn't,2021," Electrical Engineer in Auckland, Auckland",1,Was a great team None that are worth the headache. - Had a lot of corporate bloat software that was complex and difficult to manage what was important and what wasn't
121,Great experience,4,Current Employee,Very good work environment and culture,Work load may vary based in project needs,2021, Systems IS Engineer ,1,Great experience Very good work environment and culture Work load may vary based in project needs
122,Good life work balance,4,Current Employee,"Good life work balance, nice work culture",Slow in adapting to new technologies,2021, Systems Engineer ,1,"Good life work balance Good life work balance, nice work culture Slow in adapting to new technologies"
123,The BEST Automotive Company,5,"Former Employee, more than 1 year",I've worked for many different automotive companies and Aptiv is surely the BEST. Great Pay Great Benefits Great colleagues Great management team Great Office Building Great Environment Great Technology Great Global portfolio,Not Applicable. There is none.,2021," Vehicle Test Engineer in Troy, MI",1,The BEST Automotive Company I've worked for many different automotive companies and Aptiv is surely the BEST. Great Pay Great Benefits Great colleagues Great management team Great Office Building Great Environment Great Technology Great Global portfolio Not Applicable. There is none.
126,A good company to work on,5,"Former Employee, more than 1 year",They treat they employees very nicely and there's a very nice communication between management and employees.,Sometimes workloads are impossible to handle.,2021, ITV Technician in Ciudad Juarez,1,A good company to work on They treat they employees very nicely and there's a very nice communication between management and employees. Sometimes workloads are impossible to handle.
129,Great culture,5,"Current Employee, more than 10 years",A work environment in which you have the opportunity to learn and develop professionally.,I don't any cons about.,2021," Human Resources in Ineu, Arad, Arad",1,Great culture A work environment in which you have the opportunity to learn and develop professionally. I don't any cons about.
130,Great place to Work and learn!!,5,Current Employee,If you are a fresher then APTIV is great place to start with . As the working culture here in Aptiv is very adaptive . Aptiv has a ability to build professional relationships with colleagues.,"As there are pros as well as cons for everything,i will not say much but as Aptiv has customers from all around the world, you may have to adjust with the working hours sometime.",2021, Senior Software Engineer in Bangalore,1,"Great place to Work and learn!! If you are a fresher then APTIV is great place to start with . As the working culture here in Aptiv is very adaptive . Aptiv has a ability to build professional relationships with colleagues. As there are pros as well as cons for everything,i will not say much but as Aptiv has customers from all around the world, you may have to adjust with the working hours sometime."
131,Aptiv review,5,"Current Employee, more than 1 year",Great opportunity to grow and develop skills in an international environment,Very fast changing industry that requires fast adapting,2021," Recruitment Specialist in Leskovac, Central Serbia, Central Serbia",1,Aptiv review Great opportunity to grow and develop skills in an international environment Very fast changing industry that requires fast adapting
132,fair empolyer,4,"Current Employee, more than 1 year",flexible hours home office many possibilities,the management is a bit messy especially in the advanced engineering.,2021, System Engineer in Wuppertal,1,fair empolyer flexible hours home office many possibilities the management is a bit messy especially in the advanced engineering.
133,Good Place to Work At,5,"Current Employee, less than 1 year","Good Management, great work-life balance","Less flexibility in terms of working from a remote location,",2021, Data Analyst in Singapore,1,"Good Place to Work At Good Management, great work-life balance Less flexibility in terms of working from a remote location,"
134,Feedback about Aptiv,4,"Former Employee, more than 3 years",Work life balance and good platform to learn the technology,CTC is not upto the mark,2021, Advanced Software Developer in Bangalore,1,Feedback about Aptiv Work life balance and good platform to learn the technology CTC is not upto the mark
135,Decent place,5,Current Employee,Great work culture. Understanding with time off,Hard to climb up the corporate ladder,2021, Electrical Engineer ,1,Decent place Great work culture. Understanding with time off Hard to climb up the corporate ladder
136,Great company,4,"Former Employee, more than 1 year","nice environment, inclusive, good opportunities",a large company so slow to decision making,2021," Senior Engineering in Auckland, Auckland",1,"Great company nice environment, inclusive, good opportunities a large company so slow to decision making"
137,Good,4,"Current Employee, more than 1 year",good place to work in,very big company small impact,2021, Software Test Engineer in Krak贸w,1,Good good place to work in very big company small impact
138,"Great place to work, but long term job stability questionable",4,"Former Employee, more than 10 years","High tech challenges, good benefits, great colleagues.","Aptiv has a ""flexible business model"". Part of this is they will quickly shut down an operation or location to move to a more cost effective location. Aptiv is run by finance people not engineering leaders.",2021," IT Senior Manager in Kokomo, IN",1,"Great place to work, but long term job stability questionable High tech challenges, good benefits, great colleagues. Aptiv has a ""flexible business model"". Part of this is they will quickly shut down an operation or location to move to a more cost effective location. Aptiv is run by finance people not engineering leaders."
139,Be here now,5,"Current Employee, less than 1 year",Very good company to work in,"Nothing special, its a pleasure to work in",2021, Human Resources Manager in Tangier,1,"Be here now Very good company to work in Nothing special, its a pleasure to work in"
140,Be here now,5,"Current Employee, less than 1 year",Very good company to work in,"Nothing special, its a pleasure to work in",2021, Human Resources Manager in Tangier,1,"Be here now Very good company to work in Nothing special, its a pleasure to work in"
141,Aptiv - Open and Friendly,4,"Current Employee, less than 1 year","Aptiv for me means an open-minded, diverse company.",Approval processes are unflexible and slow.,2021, Senior Talent Acquisition Specialist ,1,"Aptiv - Open and Friendly Aptiv for me means an open-minded, diverse company. Approval processes are unflexible and slow."
142,Nice place to work,4,Current Employee,There is free coffe available,None beside actual pandemic situation,2021, Software Engineer ,1,Nice place to work There is free coffe available None beside actual pandemic situation
143,Awesome work environment,4,Former Employee,"Loved it, was a relaxed environment",Not a whole lot of room for growth,2021, Anonymous Employee ,1,"Awesome work environment Loved it, was a relaxed environment Not a whole lot of room for growth"
144,Decent company to work for,4,"Current Employee, less than 1 year","Good colleges, decent salary and can be a good fit for a lot of peop",Sometimes the responsibilities are not clear,2021, OTC Specialist ,1,"Decent company to work for Good colleges, decent salary and can be a good fit for a lot of peop Sometimes the responsibilities are not clear"
145,Fast phased cutting edge technology,5,"Current Employee, more than 1 year","Fast phased , step learning , cutting edge technology","Work life balance , Not a process driven company",2021," Systems Engineer in Troy, MI",1,"Fast phased cutting edge technology Fast phased , step learning , cutting edge technology Work life balance , Not a process driven company"
146,Good environment,4,Current Employee,Very Good starting salaries and big projects,No bonuses are available and the increase in salary is weak,2021, Functional Safety Engineer in Krak贸w,1,Good environment Very Good starting salaries and big projects No bonuses are available and the increase in salary is weak
148,Great Opportunities but can easily be pigeon-holed.,4,"Current Employee, less than 1 year",Great teams to work with; some career growth and exploration if you have the right manager looking out for you.,Sometimes a little too Lean in the employee workforce.,2021," Field Applications Engineer in Troy, MI",1,Great Opportunities but can easily be pigeon-holed. Great teams to work with; some career growth and exploration if you have the right manager looking out for you. Sometimes a little too Lean in the employee workforce.
150,Great,5,Former Employee,Great group of people all around,Early stages of figuring it all out,2021," Operations in Las Vegas, NV",1,Great Great group of people all around Early stages of figuring it all out
151,Well paid and interesting but you will loose your mind,2,"Former Employee, more than 1 year",Good Salary and interesting technology,"Bad working atmosphere, tough management",2021, Mechanical Engineer in Braga,0,"Well paid and interesting but you will loose your mind Good Salary and interesting technology Bad working atmosphere, tough management"
152,lots of bureaucracy,2,Former Employee,"Well, there are none. Just make your money worth",there are lots of bureaucracy,2021, Vehicle Tester/Engineer ,0,"lots of bureaucracy Well, there are none. Just make your money worth there are lots of bureaucracy"
153,OK,2,"Current Employee, more than 5 years",ok working there nothing much to complain,ok working there nothing to grow,2021," Warehouse Worker in Ang Mo Kio New Town,",0,OK ok working there nothing much to complain ok working there nothing to grow
154,Middle of the Road,4,Current Employee,"Lots of growth opportunities, and some of the best coworkers I've found yet in my career. The things we've been able to accomplish across the globe with multi-national teams have been truly remarkable.","The culture at APTIV is more of a shapeless forming blob. As Delphi, APTIV had a distinct culture of ""Excellence"" stemming back to the Packard days, and a proud history there as well. Companies such as Control-Tec and Unwired also had their own distinct cultures that were more like google and made your team feel more akin to family. Plenty of work got done above and beyond due to this. Now those have been stripped away into the APTIV Culture, and it is palpable in comparison to those hay-days.",2020," Senior Systems Engineer in Auburn Hills, MI",1,"Middle of the Road Lots of growth opportunities, and some of the best coworkers I've found yet in my career. The things we've been able to accomplish across the globe with multi-national teams have been truly remarkable. The culture at APTIV is more of a shapeless forming blob. As Delphi, APTIV had a distinct culture of ""Excellence"" stemming back to the Packard days, and a proud history there as well. Companies such as Control-Tec and Unwired also had their own distinct cultures that were more like google and made your team feel more akin to family. Plenty of work got done above and beyond due to this. Now those have been stripped away into the APTIV Culture, and it is palpable in comparison to those hay-days."
155,Great Place to Work,5,Former Employee,"There is flexibility, profesionalism and compromise","I can't think of one, it aways depend on the business unit",2021, Technical Manager ,1,"Great Place to Work There is flexibility, profesionalism and compromise I can't think of one, it aways depend on the business unit"
157,Work Life balance,5,"Current Employee, more than 3 years",Maintaining a good focus and good management,Less work life balance due to work pressure,2021, Systems Engineer ,1,Work Life balance Maintaining a good focus and good management Less work life balance due to work pressure
158,Great company,4,"Current Employee, more than 1 year",Lots of things to learn,Lots of work to do,2021," Function Owner in Sterling Heights, MI",1,Great company Lots of things to learn Lots of work to do
159,Great Environment,4,"Former Employee, more than 1 year",The environment is very nice and supportive. The people are really friendly and ready to help.,"The working plan is not very clear, the hierarchy is not well structured and a lot of people are taking the decision.",2021, Working Student in Wuppertal,1,"Great Environment The environment is very nice and supportive. The people are really friendly and ready to help. The working plan is not very clear, the hierarchy is not well structured and a lot of people are taking the decision."
160,Nice and lot of learning,4,"Former Employee, more than 1 year","Quality food,free transport,satisfy salary, supportive management.",Sometimes 12 hours shift and not given leave,2021, Machine Operator in Vallam,1,"Nice and lot of learning Quality food,free transport,satisfy salary, supportive management. Sometimes 12 hours shift and not given leave"
161,overall good experience,4,"Former Employee, more than 3 years",company has interesting products and projects,the work atmosphere and the workstyle is more traditional,2021, Development Engineer in Wuppertal,1,overall good experience company has interesting products and projects the work atmosphere and the workstyle is more traditional
162,Good technology and top level active safety leadership,4,Current Employee,Some very good active safety leadership at the very top level Many strong engineers at the working levels,Need to root out the bad leaders who compromise the organization,2020," Chief Engineer in Troy, MI",1,Good technology and top level active safety leadership Some very good active safety leadership at the very top level Many strong engineers at the working levels Need to root out the bad leaders who compromise the organization
164,Great company!,5,Former Employee,"Good pay, good bonus at the end of the year, good benefits and good management",Cannot think of any cons. I learnt a lot and had a good experience overall.,2021, Anonymous Employee ,1,"Great company! Good pay, good bonus at the end of the year, good benefits and good management Cannot think of any cons. I learnt a lot and had a good experience overall."
166,Pathetic place,1,"Former Employee, less than 1 year",Free travel. Free food in the canteen.,"Pathetic place to work. Apart from traveling allowance, nothing is good about the organisation",2021, Anonymous Employee ,0,"Pathetic place Free travel. Free food in the canteen. Pathetic place to work. Apart from traveling allowance, nothing is good about the organisation"
167,Innovation,4,"Former Employee, more than 1 year","Great Work, Innovative Team, Smart People, Collaborative Environment, Leadership Transparency",Management can use more training.,2021," Identity and Access Management Engineer in Boston, MA",1,"Innovation Great Work, Innovative Team, Smart People, Collaborative Environment, Leadership Transparency Management can use more training."
168,Great people!,5,Former Employee,Good colleagues and great working environment,sometimes - no scope for further development and lack of opportunities,2021, Systems Engineer in Wuppertal,1,Great people! Good colleagues and great working environment sometimes - no scope for further development and lack of opportunities
171,Very good company for beginners and professionals,5,Current Employee,- new techology in automotive -,None at the moment,2021, Project Manager in Krak贸w,1,Very good company for beginners and professionals - new techology in automotive - None at the moment
172,Still ok,2,"Current Employee, more than 5 years","Good benefits (Medical, dental, AL)","Not systemic, not everyone follow procedure",2021, Engineering Assistant ,0,"Still ok Good benefits (Medical, dental, AL) Not systemic, not everyone follow procedure"
173,stock market motivated,2,"Current Employee, more than 10 years",the compensation is adequate at this company,company does not value employees. burn out and terminate,2021," Sales in Troy, MI",0,stock market motivated the compensation is adequate at this company company does not value employees. burn out and terminate
174,Good company for juniors,4,Former Employee,"Freedom, relatively well paid in Michigan.",Management needs improvement to make employees focus on the projects.,2021," Software Engineer in Troy, MI",1,"Good company for juniors Freedom, relatively well paid in Michigan. Management needs improvement to make employees focus on the projects."
175,Salary for Team Lead,4,"Current Employee, more than 8 years","Good pay, good infrastructure, good people","Work life balance, no growth after 12 or 13 years of ecperience",2021, Team Leader in Bangalore,1,"Salary for Team Lead Good pay, good infrastructure, good people Work life balance, no growth after 12 or 13 years of ecperience"
176,"Aptiv, the place where you can grow your career",5,Current Employee,"Open and transparent communication, great and supportive colleagues, truly international environment, plenty of career opportunities, interesting and diverse projects, many are working with top-notch technology i.e. autonomous driving, advanced driver-assistance systems, e-mobility solutions and power & signal distribution.",Nothing I could mention here since topics I would have raised in the past did improve a lot within the last months. I'm really happy here and am glad that I joined Aptiv 2 years ago.,2020, Talent Acquisition Manager in Wuppertal,1,"Aptiv, the place where you can grow your career Open and transparent communication, great and supportive colleagues, truly international environment, plenty of career opportunities, interesting and diverse projects, many are working with top-notch technology i.e. autonomous driving, advanced driver-assistance systems, e-mobility solutions and power & signal distribution. Nothing I could mention here since topics I would have raised in the past did improve a lot within the last months. I'm really happy here and am glad that I joined Aptiv 2 years ago."
178,Best in Automotive,5,"Former Employee, more than 1 year","Work life balance, Salary, Culture,Work,Diversity",Nothing all is good about being here,2021, Advanced Software Engineer in Bangalore,1,"Best in Automotive Work life balance, Salary, Culture,Work,Diversity Nothing all is good about being here"
179,Good to start with,4,"Current Employee, more than 3 years",You get hands on. Support Good environment,Work schedule depends on projects No much facilities like cafeteria,2021, Senior Test Engineer in Bangalore,1,Good to start with You get hands on. Support Good environment Work schedule depends on projects No much facilities like cafeteria
